{
  "eventId": "11111111-1111-4111-8111-111111111111",
  "eventType": "TradeNormalized",
  "schemaVersion": 1,
  "occurredAt": "2026-07-24T03:00:00Z",
  "producer": "property-data",
  "aggregateType": "Trade",
  "aggregateId": "trade-501",
  "aggregateVersion": 17,
  "correlationId": "rtms-run-20260724",
  "causationId": null,
  "traceId": "trace-111",
  "payload": {
    "tradeId": "trade-501",
    "complexId": 501,
    "dealDate": "2026-07-22",
    "dealAmount": 125000,
    "exclArea": 84.99,
    "tradeStatus": "ACTIVE"
  }
}
